mls_id,address,unit_number,full_address,zip,area,block,block_raw,lot,complex_name,property_type,class,status,year_built,floor_number,bedrooms,full_baths,half_baths,total_baths,sqft,sold_price,list_price,orig_list_price,price_per_sqft,sale_to_list,orig_to_sold_pct,taxes,hoa_monthly,dom,closing_date,listing_date,closing_year,closing_quarter,is_distressed,is_short_sale,is_bank_owned,lat,lon,between,remarks,parking,parking_conf,outdoor,outdoor_type,outdoor_conf,walk_score,transit_score,bike_score,path_station,path_dist_mi,hblr_station,hblr_dist_mi,transit_station,transit_dist_mi,modiiv_assessed,assessed_value,assess_ratio
210015623,250 HENLEY PL,410,250 HENLEY PL 410,07086,Weehawken,block_45 01_HENLEY,00045 01,00001 01,Henley on Hudson,Condominium,CONDO-COOP,SOLD,,4,3,3,0,3.0,1529,1175000.0,1229000.0,,768.48,0.9561,,20114.0,930.0,98,2021-11-24,2021-06-28,2021,2021-Q4,False,False,False,40.7677321,-74.0166051,River Road to Henley Place,"Live life on the water. Live life with views. Live life on your terms. Unrivaled penthouse and waterfront living at its finest. An exclusive private community enraptures you in this world-class luxury residence located at prestigious Henley on Hudson. Be captivated by this contemporary and ultra-sleek 3 Bedroom and 3 Full Bathroom home, sweeping across 1,529 sqft of unparalleled space to live for. Encompassing brand new wood flooring throughout the expanse, and all the polished, streamlined, gleaming finishes you would expect in a home of this caliber. With South, West, and North views, and a magnificently designed layout for entertaining and daily living, behold a dwelling for the most discerning buyer. An effusive open layout with a living room leading to an entrée to your dining room, then flowing to your entertaining kitchen is the perfect flow for your life and what your dreams are made of. A designer-inspired gourmet chef's kitchen with glimmering white quartz countertops, stainless steel appliances, and dark wood cabinetry. Further showcasing a French door refrigerator with a lower, pull out drawer-style freezer, in-wall oven and convection/microwave oven, 5-burner stove, and a custom center island to place a buffet smorgasbord and host your dinner parties from. An entrancing and incredible Master Suite awaits with custom-built closeting and the pièce de résistance of a fully tiled master bath behind glass-enclosed doors featuring a spa retreat for your senses, highlighted by double vanities and a luxurious deep-set soaking tub with an expansive walk-in shower and built-in bench. A second spacious bedroom, then moving into a third bedroom with custom French doors as an idyllic special bonus room for your lifestyle desires. When it comes to lustrous living like this, it is all in the details. Satiny, glowing pedestal lights, base moulding along the floorboards, ceiling fans, recessed lighting, top of the line finishes in hardwood and tile, built-in shelving, molded window and door trim, and tray ceilings in every living area of the dwelling. Drawing your attention to oversized windows for maximum light and viewing exposures and a wood-burning fireplace in your living quarters to add to the ambiance of your sanctuary. Be captured in the beauty of astounding NYC and Hudson River views from your private terrace. The Henley on Hudson community is located along New Jersey's Gold Coast overlooking iconic NYC with the best commute to and from the greatest City in the World. Of course, a community of this stature offers a concierge, two state-of-the-art fitness centers, sauna, lounge, billiards, and a patio room connecting to an infinity pool with stunning views of the Empire State Building and Hudson River. With two-car garage parking on the ground level and all the amenities of an upscale lifestyle, live a life worthy of you.",True,high,True,terrace,high,,,,Hoboken,2.248,Port Imperial,1.226,Port Imperial,1.226,,,
210001371,800 AVENUE AT PORT IMPERIAL,902,800 AVENUE AT PORT IMPERIAL 902,07086,Weehawken,block_64.01_AVENUE,64.01,1.07,Avora,Condominium,CONDO-COOP,SOLD,,9,2,2,0,2.0,1525,1175000.0,1220000.0,,770.49,0.9631,,22754.0,1124.0,132,2021-06-30,2021-01-15,2021,2021-Q2,False,False,False,40.7767352,-74.0112977,River Road and Avenue at Port Imperial,"Just steps away from the NY Waterway Ferry Terminal offering a stress-free ride to Midtown Manhattan as well as routes to Pier 11 at Wall St. and World Financial Center. Redefining modern luxury and style, with upscale interior finishes, private balconies and terraces maximizing majestic NYC views. Exceptional amenity package! Avora features a spectacular lobby with 24 hour concierge, grand salon, private screening theater, business center, boardroom, Avora lounge with bar, private dining and catering kitchen, pet spa, and state of the art strength and cardio fitness center. Landscaped outdoor plaza including a pool, spacious sun deck, lounges, grilling areas and fire pits. 184 homes situated in an 11-story building on the Hudson River waterfront with unparalleled views!!  One Parking Space included. Call now for current incentives!",True,high,True,balcony,high,,,,Hoboken,2.915,Port Imperial,1.905,Port Imperial,1.905,,,
220005605,800 AVENUE AT PORT IMPERIAL,312,800 AVENUE AT PORT IMPERIAL 312,07086,Weehawken,complex_AVORA,,,Avora,Condominium,CONDO-COOP,SOLD,,3,2,2,0,2.0,1423,1180000.0,1245000.0,,829.23,0.9478,,22335.0,1027.0,131,2022-10-06,2022-04-01,2022,2022-Q4,False,False,False,40.7767352,-74.0112977,Port Imperial Blvd to Avenue at Port Imperial,"Luxury Waterfront Living at Port Imperial's Avora! This premiere 2 Bed/Den with 2 Full Bath home features your private patio overlooking NYC Midtown views & Pool Deck! This home offers a 1,423 sf open floor plan with 3rd Bed option, European modern high gloss lacquered kitchen cabinetry, Quartz countertop with waterfall island, KitchenAid Architectural Stainless Steel appliances including Washer/Dryer and Hardwood flooring throughout plus Storage & 1 Indoor Garage Parking. Take advantage of resort style living with access to an incredible 3rd floor pool deck with barbeque and firepit patio. State-of-the-Art fitness center, sauna, steam showers, media room, business center, private dining, sports simulator, resident lounges and of course Avora's full-service 24-hour concierge service including Pet friendly featuring an onsite pet spa. Just steps away to the New York Waterway Ferry, Hudson/Bergen Light Rail and NJ Transit Buses. Convenience at your doorstep! Avora Lifestyle Awaits!",True,high,True,deck,high,,,,Hoboken,2.915,Port Imperial,1.905,Port Imperial,1.905,,,
230015797,22 CAMBRIDGE WAY,,22 CAMBRIDGE WAY,07086,Weehawken,block_45.01_CAMBRIDGE,45.01,1.01,Henley On Hudson,Condominium,CONDO-COOP,SOLD,,2,2,3,0,3.0,1868,1180000.0,1200000.0,,631.69,0.9833,,17673.0,1220.0,68,2024-02-01,2023-09-20,2024,2024-Q1,False,False,False,40.7683891,-74.0166158,Henley Place & River Road,"Experience elegant living in this exquisite 2-bedroom plus Den condo duplex, nestled within the prestigious community of Henley on the Hudson in Weehawken, NJ. Recently upgraded, this home boasts a modern kitchen, new flooring, and a spacious layout. The walk-in custom closets offer ample storage, while custom shades throughout add a touch of luxury. The well-designed Den area, conveniently situated next to the master suite, is perfect for a nursery or a home office. And at any given moment, step outside to a generously sized patio, creating an ideal space for relaxation and entertaining.",False,low,True,patio,high,,,,Hoboken,2.292,Port Imperial,1.269,Port Imperial,1.269,,,
210015443,800 AVENUE AT PORT IMPERIAL,302,800 AVENUE AT PORT IMPERIAL 302,07086,Weehawken,block_64.01_AVENUE,64.01,1.07,AVORA at Port Imperial,Condominium,CONDO-COOP,SOLD,,3,2,2,0,2.0,1695,1195000.0,1250000.0,,705.01,0.956,,23041.0,1242.0,6,2021-08-04,2021-06-25,2021,2021-Q3,False,False,False,40.7767352,-74.0112977,AVORA at Port Imperial,"AVORA - Welcome to Residence 302. Be the first to live in this extraordinary new condominium with 1695-sf, terrace and beautiful river & city views. Distinctive finishes include beautiful wood floors, quartz waterfall counters, contemporary cabinetry, exquisite porcelain tile, high-end stainless steel appliances and custom selected hardware & fittings. Building amenities include 24-hour concierge service, health club, media room, sports simulator, resident lounges and the amazing 3rd floor pool deck & barbecue patio. Avora residents enjoy NY Waterway Ferry service, Hudson/Bergen Light Rail & NJ Transit Bus service literally steps from the lobby door. Come experience living here!",False,low,True,terrace,high,,,,Hoboken,2.915,Port Imperial,1.905,Port Imperial,1.905,,,
210000144,1200 AVENUE AT PORT IMPERIAL,707,1200 AVENUE AT PORT IMPERIAL 707,07086,Weehawken,block_64 01_AVENUE,00064 01,00001 10,,Condominium,CONDO-COOP,SOLD,,7,2,2,0,2.0,1315,1195000.0,1285000.0,,908.75,0.93,,22316.0,1155.0,38,2021-05-21,2021-01-04,2021,2021-Q2,False,False,False,40.7728849,-74.0126191,River Rd to Port Imperial,"Penthouse unit 707, one of the most unique and premier residences at the luxurious Avenue Collection, is being offered by Jalinos Properties. At 1315 sf, this beautiful unit boasts 11’ ceilings, 2 bedrooms, 2 full bathrooms, large main balcony and one of a kind private balcony off the master suite, both with breathtaking views of the Hudson River and NYC skyline. The floor to ceiling windows are adorned with custom window treatments, and the large master bathroom features a private water closet, large soaking tub, separate shower, porcelain tile, and dual vanity sinks. The high-end finishes in the kitchen include Spazzi lacquered cabinetry, GE Monogram appliances, including gas range, dual zone wine fridge, Kohler touchless faucet, garbage disposal, and quartz countertops with eat-in counter space. Additional features include full sized washer and dryer, custom paint, and select designer light fixtures. Included in this offering is a deeded reserved parking space in the attached garage, as well as an on-premises, highly coveted, deeded storage unit. The 1200 Avenue building, one of the most desirable waterfront buildings on the Gold Coast, is only 3 short blocks from the Port Imperial Ferry. Building amenities include 24/7 concierge, outdoor pool, large sun deck with catering bar and fire pit, fitness center with locker rooms, sauna and steam showers, children’s playroom, theatre, bicycle storage, cold storage for groceries, and a beautiful entertainment room with large terrace and sweeping views of the city. Don’t miss the opportunity to make the gorgeous, exclusive residence your new home.",True,high,True,terrace,high,,,,Hoboken,2.64,Port Imperial,1.632,Port Imperial,1.632,,,
220015020,53 ETON ROW,,53 ETON ROW,07086,Weehawken,block_45.041,45.041,1.01,Henley on Hudson,Condominium,CONDO-COOP,SOLD,,,3,3,0,3.0,1565,1200000.0,1249000.0,,766.77,0.9608,,22375.0,950.0,120,2023-01-05,2022-08-17,2023,2023-Q1,False,False,False,40.7674671,-74.017338,Henley Pl to Eton Row,"World-class luxury awaits you in this unrivaled condo with breathtaking panoramic views of New York City from every room located in the prestigious Henley on Hudson community. This ultra-sleek contemporary 3 Bed / 3 Full Bath home spans approximately 1,565 SqFt of magnificently open space for your eyes to feast upon, with an expertly designed layout for entertaining and daily living. Relish the opulent feeling you will experience with gleaming wood flooring, top-of-the-line finishes, a state-of-the-art kitchen, and an incredible primary ensuite including a glamorous marble bathroom with double vanities, a full array of mirrors, a glass-enclosed shower, and an extra-large soaking tub for your spa-like pleasures. Finishing out the home are two spacious bedrooms, one an additional ensuite, and large ample custom closets throughout. Savor your private, large terrace stretching across the unit that sits upon the vista of the beautiful English Garden and stunning views of NYC. Truly a residence this magnificent encompasses the added bonus of garage parking in the building with extra parking around the community! Henley on Hudson is located along New Jersey's finest Gold Coast overlooking iconic NYC with an easy commute to/from the City and the delectable delights of high-class shopping, dining, and entertainment at your doorstep. The community offers a plethora of luxe amenities: concierge, two fitness centers, sauna, lounge, billiards, and patio room connecting to an infinity pool where you can partake in outstanding views of the Empire State Building and the Hudson River. Here is the one you have been waiting for, encapsulating everything you are looking for to live, work, and play, all within your beautiful abode and surrounds.",True,high,True,terrace,high,,,,Hoboken,2.223,Port Imperial,1.197,Port Imperial,1.197,,,
210018512,800 AVENUE AT PORT IMPERIAL,PH 1002,800 AVENUE AT PORT IMPERIAL PH 1002,07086,Weehawken,block_64.01_AVENUE,64.01,1.07,Avora,Condominium,CONDO-COOP,SOLD,,,2,2,0,2.0,1531,1200000.0,1275000.0,,783.8,0.9412,,23379.0,1120.0,39,2021-11-10,2021-08-03,2021,2021-Q4,False,False,False,40.7767352,-74.0112977,River Road and Avenue at Port Imperial,"Just steps away from the NY Waterway Ferry Terminal offering a stress-free ride to Midtown Manhattan as well as routes to Pier 11 at Wall St. and World Financial Center. Redefining modern luxury and style, with upscale interior finishes and majestic NYC views. Exceptional amenity package! Avora features a spectacular lobby with 24 hour concierge, grand salon, private screening theater, business center, boardroom, Avora lounge with bar, private dining and catering kitchen, pet spa, and state of the art strength and cardio fitness center. Landscaped outdoor plaza including a pool, spacious sun deck, lounges, grilling areas and fire pits. 183 homes situated in an 11-story building on the Hudson River waterfront with unparalleled views! Photos are of a similar home in the building. One parking space is included and 2 years of HOA on the remaining homes!!",True,high,True,deck,high,,,,Hoboken,2.915,Port Imperial,1.905,Port Imperial,1.905,,,
240007799,24 ETON ROW,,24 ETON ROW,07086,Weehawken,complex_HENLEYONHUDSON,,,Henley on Hudson,Condominium,CONDO-COOP,SOLD,,2,2,2,1,2.5,1640,1200000.0,1200000.0,,731.71,1.0,,19099.0,1106.0,4,2024-05-30,2024-04-26,2024,2024-Q2,False,False,False,40.7674881,-74.0171798,Off Port Imperial,"Welcome to this rare and highly desirable two-bedroom, three-bathroom home! Step into elegance with an amazing outdoor terrace directly off the living room and kitchen, providing a seamless indoor-outdoor lifestyle with breathtaking midtown views. This exquisite residence features an extra-large primary suite, complete with a rare-sized walk-in closet that is unparalleled for waterfront living. 24 Eton Row is a proud member of Henley On Hudson, a well-manicured community of luxury homes whose amenities include a concierge, swimming pool, two fitness centers, children's playroom, and cinema. Residents relish the direct access to the New York Waterway and unparalleled views of The Greatest City in the World.",False,low,True,terrace,high,,,,Hoboken,2.225,Port Imperial,1.2,Port Imperial,1.2,,,
220004641,600 HARBOR BLVD,779,600 HARBOR BLVD 779,07086,Weehawken,block_34.03_HARBOR,34.03,4.19,Riva Pointe,Condominium,CONDO-COOP,SOLD,,1,2,3,0,3.0,2232,1200000.0,999000.0,,537.63,1.2012,,31974.0,1915.0,33,2022-06-24,2022-03-17,2022,2022-Q2,False,False,False,40.7600589,-74.0218974,River Rd to Harbor Blvd,"This is it! The most spectacular, panoramic views of the Manhattan skyline and Hudson River can be yours in this one-of-kind end unit in the newest phase of the complex. Live in spacious luxury in this 2232 sq ft duplex 2 BR with 3 full bathrooms, hardwood floors throughout, and open kitchen with Subzero fridge and stone counters. Enjoy the fresh air and sunshine from one of the three over-sized balconies, or relax by the wood burning fireplace and take in the views from the wall of windows. Wake up to gorgeous city and river  views in the spacious master suite with en-suite bathroom and walk-in closet. Washer/dryer in unit and one garaged parking space included. Amenities include state-of-the-art gym, indoor heated pool, and 24 hr concierge. The ultimate location on the Waterfront features Whole Foods, NYC Ferry, Light Rail and Bus all at your doorstep. Taxes are currently under appeal.",True,high,True,balcony,high,,,,Hoboken,1.683,Port Imperial,0.642,Port Imperial,0.642,,,
240009164,23 CAMBRIDGE WAY,,23 CAMBRIDGE WAY,07086,Weehawken,block_45.01_CAMBRIDGE,45.01,1.01,Henley on Hudson,Condominium,CONDO-COOP,SOLD,,,3,3,0,3.0,1868,1200000.0,1199910.0,,642.4,1.0001,,19097.0,1286.0,6,2024-08-09,2024-05-15,2024,2024-Q3,False,False,False,40.7683891,-74.0166158,River Road to Henley Place to Cambridge Way,"Welcome home to this stunning 3 Bedroom / 3 Bathroom duplex located in prestigious Henley on Hudson. Situated along the banks of the Hudson River, this meticulously well kept home stretches across 1,868 SqFt and features beautiful hardwood floors, an open concept, custom window treatments, in-unit laundry, and one garage parking space. First floor includes entrance foyer, living room / dining room combo, gorgeous Chef's kitchen, full bathroom, family room w/ custom built-ins, and balcony. Chef's kitchen features Viking appliances, granite countertops, custom cabinets, and breakfast bar. Travel to the second floor where you'll find a spacious Master bedroom with spa-like ensuite bathroom and walk-in closet, two guest bedrooms, full bathroom, and laundry. Henley on Hudson features world-class amenities including concierge, outdoor pool w/ jacuzzi, fitness center, movie theatre, kids playroom, social room, and shuttle to/from Ferry and Lightrail station. Don't miss out on this one!",True,high,True,balcony,high,,,,Hoboken,2.292,Port Imperial,1.269,Port Imperial,1.269,,,
260000914,1000 AVENUE AT PORT IMPERIAL,306,1000 AVENUE AT PORT IMPERIAL 306,07086,Weehawken,block_64.01_AVENUE,64.01,1.11,The Avenue Collection,Condominium,CONDO-COOP,SOLD,,3,2,2,0,2.0,1295,1212000.0,1288000.0,,935.91,0.941,,20622.0,1191.0,25,2026-03-31,2026-01-19,2026,2026-Q1,False,False,False,40.774254,-74.011431,Avenue Collection 1000,"THE AVENUE COLLECTION Building 1000 - Residence 306. Boasting 1295-SF plus a full-length terrace, this 2-Bedroom showplace has glorious direct Hudson River and Manhattan skyline views from every window. Spectacularly reimagined, you'll love the just completed comprehensive upgrades that include beautiful wood floors, refinished cabinetry and enhanced lighting. 9-foot ceilings and oversized windows grace this home with wonderful light. Monogram appliances, fixtures by Kohler, beautiful porcelain tile, custom fitted closets and stunning quartz counters complete this rare and wonderful offering. A deeded parking space is included. Come experience living in one of Port Imperial's finest buildings in this coveted location just one block from the ferry terminal. The boutique lifestyle of the Avenue Collection includes 24-hour concierge service, health club, the Hudson Room resident lounge, 2 guest suites and the 3rd level resort style deck overlooking the river. Welcome Home!",True,high,True,terrace,high,,,,Hoboken,2.748,Port Imperial,1.743,Port Imperial,1.743,,,
240008705,1200 AVENUE AT PORT IMPERIAL,303,1200 AVENUE AT PORT IMPERIAL 303,07086,Weehawken,block_64_AVENUE,64,01,Avenue Collection 1200,Condominium,CONDO-COOP,SOLD,,3,2,2,0,2.0,1307,1218000.0,1228000.0,,931.91,0.9919,,21285.0,1347.0,14,2024-07-15,2024-05-09,2024,2024-Q3,False,False,False,40.7728849,-74.0126191,Avenue Collection,"THE AVENUE COLLECTION - Building 1200 - Residence 303. Floor-to-ceiling windows and ceilings over 9-ft tall grace this lovely home with beautiful northern light. With 1307-SF, the ideal split-bedroom wing floorplan features a 40-ft full-length balcony with dynamic views of midtown Manhattan. An open concept living area is anchored by a well appointed peninsula kitchen. Monogram appliances, fixtures by Kohler, exquisite porcelain tile details and layers of lighting grace the kitchen and bathroom. Stunning wood floors and deeded parking complete this rare offering in Port Imperial's finest building just 2 blocks from the ferry terminal. Come experience the boutique lifestyle of the Avenue Collection that includes 24-hour concierge service, health club, movie theatre, kid's playroom, penthouse level Skyline Lounge and the ultimate 3rd level resort style pool deck. Welcome Home.",True,high,True,balcony,high,,,,Hoboken,2.64,Port Imperial,1.632,Port Imperial,1.632,,,
240015616,1000 AVENUE AT PORT IMPERIAL,507,1000 AVENUE AT PORT IMPERIAL 507,07086,Weehawken,block_64_AVENUE,00064,00001,The Avenue Collections,Condominium,CONDO-COOP,SOLD,,5,2,2,0,2.0,1392,1223000.0,1150000.0,,878.59,1.0635,,22807.0,1273.0,17,2024-09-30,2024-08-08,2024,2024-Q3,False,False,False,40.774254,-74.011431,Port Imperial Blvd to Ave at Port Imperial,"Discover the pinnacle of contemporary luxury in this stunning 2-bedroom, 2-bathroom residence, featuring sleek and modern design & beautiful finishings. The living and dining areas are designed for seamless entertaining,w/ a chef's kitchen, European cabinetry, granite countertops, and high-end professional appliances. Step onto the spacious balcony to take in breathtaking views of New York City. The Avenue Collection provides exceptional hotel-like amenities, including a 24-hour doorman, concierge services, and a state-of-the-art fitness center with a sauna, steam shower, cardio and strength equipment, and a yoga room. The outdoor area has a convenient kitchen, open lawn, lounge areas, a fire pit, and a sun deck. Residents also enjoy the social room with a catering kitchen, fireplace, and bar area. Minutes away from NYC via NY Waterway Ferry, with the Hudson Light Rail to Path/MTA directly across from the building. Whole Foods, restaurants, & shops are just minutes from your door!",False,low,True,balcony,high,,,,Hoboken,2.748,Port Imperial,1.743,Port Imperial,1.743,,,
240020998,800 AVENUE AT PORT IMPERIAL,716,800 AVENUE AT PORT IMPERIAL 716,07086,Weehawken,block_64.01_AVENUE,64.01,1.07,AVORA,Condominium,CONDO-COOP,SOLD,,7,2,2,0,2.0,1349,1235000.0,1248000.0,,915.49,0.9896,,20230.0,1094.0,42,2025-03-07,2024-10-25,2025,2025-Q1,False,False,False,40.7767352,-74.0112977,AVORA at Port Imperial,"AVORA Residence 716 is an ideal 2-Bedroom home with 1349-SF plus a glass walled balcony with dynamic views of the midtown Manhattan skyline and the Hudson River. An appealing split-bedroom wing layout is anchored by a gorgeous kitchen boasting generous fine cabinetry, quality appliances and quartz counters on a waterfall peninsula. Exquisite spa-like bathrooms feature porcelain tile and fittings by Kohler and Robern. Building amenities include 24-hour concierge service, health club, media room, sports simulator, resident lounges and the amazing pool deck & barbecue patio. Avora residents enjoy the transit hub literally steps from the lobby door. Come experience living here!",False,low,True,balcony,high,,,,Hoboken,2.915,Port Imperial,1.905,Port Imperial,1.905,,,
210003711,800 AVENUE AT PORT IMPERIAL,911,800 AVENUE AT PORT IMPERIAL 911,07086,Weehawken,block_64.01_AVENUE,64.01,1.01,Avora,Condominium,CONDO-COOP,SOLD,,9,3,2,0,2.0,1551,1240000.0,1235000.0,,799.48,1.004,,28840.0,1131.0,2,2021-03-25,2021-02-14,2021,2021-Q1,False,False,False,40.7767352,-74.0112977,Avora at Port Imperial,"AVORA - Welcome to Residence 911. Be the first to live in this extraordinary new condominium with 1551 sf and beautiful direct Hudson River & New York views. Spectacular finishes include beautiful wood floors, quartz waterfall counters, contemporary cabinetry, exquisite porcelain tile, high-end stainless steel appliances and custom selected hardware & fittings. Building amenities include 24-hour concierge service, health club, media room, sports simulator, resident lounges and the amazing 3rd floor pool deck & barbecue patio. Avora residents enjoy NY Waterway Ferry service, Hudson/Bergen Light Rail & NJ Transit Bus service literally steps from the lobby door. Come experience living here!",False,low,True,deck,high,,,,Hoboken,2.915,Port Imperial,1.905,Port Imperial,1.905,,,
