mls_id,address,unit_number,full_address,zip,area,block,block_raw,lot,complex_name,property_type,class,status,year_built,floor_number,bedrooms,full_baths,half_baths,total_baths,sqft,sold_price,list_price,orig_list_price,price_per_sqft,sale_to_list,orig_to_sold_pct,taxes,hoa_monthly,dom,closing_date,listing_date,closing_year,closing_quarter,is_distressed,is_short_sale,is_bank_owned,lat,lon,between,remarks,parking,parking_conf,outdoor,outdoor_type,outdoor_conf,walk_score,transit_score,bike_score,path_station,path_dist_mi,hblr_station,hblr_dist_mi,transit_station,transit_dist_mi,modiiv_assessed,assessed_value,assess_ratio
210026502,2716 PALISADE AVE,303,2716 PALISADE AVE 303,07086,Weehawken,block_29_PALISADE,29,2,The Maple,Condominium,CONDO-COOP,SOLD,,3,3,2,0,2.0,1420,850000.0,850000.0,,598.59,1.0,,,,0,2022-07-11,2021-12-02,2022,2022-Q3,False,False,False,40.7688126,-74.0283525,use GPS,"3BR/2BTH unit in high end, brand new construction 4 story elevator building with 2 deeded parking spots. Unit boasts 1420 sq feet of luxury living with wide open floor plan and balcony off living area. Wide plank hardwood floors run throughout entire unit. Kitchen has Quartz countertops, GE Cafe stainless steel appliances and island. Master suite has a huge walk-in closet and master bath with double vanity and walk-in shower. Space for home office directly outside master bedroom. Two large guest bedrooms share a full bath off hallway. Washer/dryer in unit.",True,high,True,balcony,high,,,,Hoboken,2.289,Port Imperial,1.258,Port Imperial,1.258,,,
250022524,83 LIBERTY PL,2,83 LIBERTY PL 2,07086,Weehawken,zip_07086,,,,Condominium,CONDO-COOP,SOLD,,2,3,2,0,2.0,1300,850000.0,875000.0,,653.85,0.9714,,,193.0,9,2025-12-18,2025-11-01,2025,2025-Q4,False,False,False,40.7747694,-74.0195052,Boulevard East and Park Ave,"On tree-lined Liberty Place in Weehawken, a boutique three-bedroom, two-bath condominium reimagines what it means to live beautifully along the Hudson. Developed by the acclaimed CJ Investment Group, with interiors envisioned by designer Kathy Samaan, this residence blends intelligent layouts with bespoke craftsmanship at every turn. Sunlight fills expansive great rooms, where custom millwork and statement lighting create a sense of timeless sophistication. The kitchen commands attention with sleek cabinetry, a matte-black GE Café appliance suite, striking leathered granite countertops, and a large center island with seating—perfectly designed for both culinary creativity and casual gatherings.  Designer tilework curated from Bedrosians, TileBar, and Edward Martin lends a refined tone to each bath, while Kohler fixtures deliver the kind of daily indulgence you feel the moment you turn the tap. Throughout, hand-selected chandeliers and sconces layer light with warmth and elegance, elevating each space. Quality here extends far beyond design. Outside, the residence showcases durable Hardie Plank siding and 9600-series United windows—the brand’s highest-performance line—backed by a transferable lifetime warranty. The location is as coveted as the home itself. Just one block from Boulevard East, mornings begin with skyline parks and sweeping NYC views, while evenings can be savored at waterfront dining destinations such as Chart House, Molos, and Ruth’s Chris. Commuting is effortless with NYC buses, the Lincoln Harbor Light Rail, and the ferry all within walking distance. Nearby, residents enjoy shopping, schools, and parks, plus the Weehawken Waterfront with Whole Foods and the state-of-the-art Recreation Center and pool. Boutique scale, thoughtful design, and a setting that balances serene neighborhood living with effortless access to Manhattan—this Liberty Place residence is Weehawken luxury at its finest.  **Special financing available with preferred lender  at Cross Country Mortgage. Grants ranging from $15,000 to $22,000 available for down payment and/or closing cost assistance. Interest rates as low as 5.75%**",False,low,False,,low,,,,Hoboken,2.707,Port Imperial,1.666,Port Imperial,1.666,,,
250006941,800 AVENUE AT PORT IMPERIAL,513,800 AVENUE AT PORT IMPERIAL 513,07086,Weehawken,block_64.01_AVENUE,64.01,1.07,Avora at Port Imperial,Condominium,CONDO-COOP,SOLD,,5,1,1,1,1.5,1004,855000.0,899000.0,,851.59,0.9511,,15173.0,950.0,69,2025-09-02,2025-04-09,2025,2025-Q3,False,False,False,40.7767352,-74.0112977,River Rd to Avenue at Port Imperial,"Welcome to Avora at Port Imperial, the premier waterfront community offering an unparalleled luxury lifestyle along New Jersey’s Gold Coast. This spacious 1-bed+den, 1.5-bath residence boasts 1,004 sqft of sleek, modern design w/North & East-facing views of the iconic NYC skyline w/an expansive private terrace. With a modern design, this home features gorgeous wood flooring throughout, a chef-inspired kitchen w/professional-grade SS appliances, & an elegant European marble countertop. The primary ensuite is a framed by oversized windows that capture breathtaking NYC views! Highlights include an in-home W/D & indoor garage parking. Avora is fully equipped w/luxury amenities including 24-Hour Concierge, Fitness Center, Cinema Rm, Business Center, Lounge w/Bar & Kitchen, Outdoor Plaza/Pool, Sun Deck, Grilling Areas, Fire Pit, & Dog Washing Station to name a few. Easy NYC commute located moments away from NY Waterway Ferry, Light Rail, & NJ Transit Bus w/restaurants & shops nearby!",True,high,True,terrace,high,,,,Hoboken,2.915,Port Imperial,1.905,Port Imperial,1.905,,,
240021721,600 HARBOR BLVD,1057,600 HARBOR BLVD 1057,07086,Weehawken,block_34.03_HARBOR,34.03,4.19,Riva Pointe,Condominium,CONDO-COOP,SOLD,,,2,2,0,2.0,1365,855000.0,799000.0,,626.37,1.0701,,14307.0,1172.0,19,2025-02-21,2024-11-06,2025,2025-Q1,False,False,False,40.7600589,-74.0218974,Waterfront Terr & Harbor Blvd,"Experience luxury living with panoramic Hudson River views in this stunning duplex condo on the Weehawken waterfront. This charming freshly painted two bedroom, two bath unit features hardwood flooring throughout the kitchen, living and dining spaces. Enjoy a modern kitchen with stainless steel appliances, granite countertops, breakfast bar, and elegant Russian Birch cabinetry. Your private balcony offers spectacular views of Manhattan and beyond. Other notable features include: washer/dryer, great closet space, fireplace enhanced with luxurious quartzite and one parking space. Residents can take advantage of the fantastic building amenities which include an indoor pool and well-equipped health club. More parking for an additional fee across the street.",True,high,True,balcony,high,,,,Hoboken,1.683,Port Imperial,0.642,Port Imperial,0.642,,,
230004798,600 HARBOR BLVD,1001,600 HARBOR BLVD 1001,07086,Weehawken,block_34.03_HARBOR,34.03,4.13,Riva Pointe,Condominium,CONDO-COOP,SOLD,,,3,3,0,3.0,1541,869000.0,890000.0,,563.92,0.9764,,14230.0,1323.0,5,2023-05-22,2023-03-26,2023,2023-Q2,False,False,False,40.7600589,-74.0218974,Harbor Blvd and Hudson River,"Welcome to the best location on the waterfront with spectacular views of New York City and the Hudson River from your Living Room, Dining Area, Master Bedroom and Private Balcony!  This rarely available 3 bed/3 bath corner unit condominium is uniquely located at the Noth West corner of the building pier providing more windows towards West. Enter your home from your Private Townhouse Style Entrance from the Promenade Level. Enjoy all the features you are looking for; Beautiful Wood Floors, Large Windows with Northern and Western Exposure, Wood Burning Fireplace, Granite Counters with Snack Bar, Stainless Steel Appliance Suite, Washer/Dryer in unit, Skylight, and Abundant Closet Space!  A full-service building with 24/7 Concierge, State-of-the-Art Gym, Yoga Studio, Indoor Heated Pool and Dedicated Garage Parking.  Whole Foods, Dining Options, Parks and Scenic Hudson River Walkway for Running and Biking too just steps away! Quick access and convenient commute to NYC with the Ferry right next door (8 mins to Manhattan), Bus (10 mins to Port Authority) and Light Rail across the street. Come and check it out!",True,high,True,balcony,high,,,,Hoboken,1.683,Port Imperial,0.642,Port Imperial,0.642,,,
230001686,800 AVENUE AT PORT IMPERIAL,425,800 AVENUE AT PORT IMPERIAL 425,07086,Weehawken,block_64.01_AVENUE,64.01,1.07,AVORA,Condominium,CONDO-COOP,SOLD,,4,2,2,0,2.0,1165,872500.0,918000.0,,748.93,0.9504,,14491.0,912.0,27,2023-04-07,2023-01-31,2023,2023-Q2,False,False,False,40.7767352,-74.0112977,AVORA at Port Imperial,"AVORA - Welcome to Residence 425. Located on the southwest corner, this home has 1165-sf and exquisite architectural elements. Stunning diagonal columns punctuate the open plan living space creating a truly modern vibe. Spectacular finishes include beautiful wood floors, quartz counters, contemporary cabinetry, exquisite porcelain tile, high-end stainless steel appliances, custom window blinds and a curated selection of beautiful hardware & fittings. Building amenities include 24-hour concierge service, health club, media room, sports simulator, resident lounges and the amazing 3rd floor pool deck & barbecue patio. Avora residents enjoy NY Waterway Ferry service, Hudson/Bergen Light Rail & NJ Transit Bus service literally steps from the lobby door. Come experience living here!",False,low,True,deck,high,,,,Hoboken,2.915,Port Imperial,1.905,Port Imperial,1.905,,,
240008201,1200 AVENUE AT PORT IMPERIAL,313,1200 AVENUE AT PORT IMPERIAL 313,07086,Weehawken,block_64_AVENUE,64,01,Avenue Collection 1200,Condominium,CONDO-COOP,SOLD,,3,1,1,0,1.0,940,874000.0,888000.0,,929.79,0.9842,,14900.0,992.0,6,2024-06-18,2024-05-02,2024,2024-Q2,False,False,False,40.7728849,-74.0126191,Avenue Collection 1200,"THE AVENUE COLLECTION - Building 1200 - Residence 313. This one-of-a-kind 1-Bedroom gem has 940-SF plus a private garden terrace with beautiful east views of the Manhattan Skyline. Floor-to-ceiling windows 9-feet tall bathe this home in morning sun. An open concept living area is anchored by a peninsula kitchen finished with a waterfall counter. Monogram appliances, fixtures by Kohler, exquisite porcelain tile details and layers of lighting grace the kitchen and bathroom. Automated window blinds, deeded parking and deeded storage complete this rare offering in Port Imperial's finest building. Come experience the boutique lifestyle of the Avenue Collection that includes 24-hour concierge service, health club, screening theatre, kid's playroom, penthouse level Skyline Lounge and the ultimate 3rd level resort style pool deck. Welcome Home. For the year of 2024 there is a Transition Litigation Assessment of $65.24/month",True,high,True,terrace,high,,,,Hoboken,2.64,Port Imperial,1.632,Port Imperial,1.632,,,
220009930,800 AVENUE AT PORT IMPERIAL,413,800 AVENUE AT PORT IMPERIAL 413,07086,Weehawken,complex_AVORA,,,Avora,Condominium,CONDO-COOP,SOLD,,4,1,1,1,1.5,1337,875000.0,930000.0,,654.45,0.9409,,13943.0,983.0,51,2022-09-02,2022-06-01,2022,2022-Q3,False,False,False,40.7767352,-74.0112977,Port Imperial Blvd to Avenue at Port Imperial,"One-Of-A-Kind Spectacular Waterfront 1Bed+Den Home at the Avora at Port Imperial! This home features 1,337 sq ft of living space with breathtaking views from your Master Suite overlooking the New York City skyline! Res 413 features European designer gray Shaker style cabinets, Quartz countertops, Kitchen Aid Architectural Stainless Steel appliances and Hardwood flooring throughout, 1 Indoor Parking Space and Washer/Dryer included. Just steps away to the New York Waterway Ferry, Hudson/Bergen Light Rail and NJ Transit Buses. Take advantage of resort style living with access to an incredible 3rd floor pool deck with barbeque and firepit patio. State of the art fitness center, sauna, steam showers, media room, business center, private dining, sports simulator, resident lounges and of course Avora's full-service 24-hour concierge service. As well as, Pet friendly featuring an onsite pet spa. Convenience at your doorstep! Enjoy waterfront living at its finest!",True,high,True,deck,high,,,,Hoboken,2.915,Port Imperial,1.905,Port Imperial,1.905,,,
220005418,518 GREGORY AVE,A_PH3,518 GREGORY AVE A_PH3,07086,Weehawken,block_26_GREGORY,26,4,Gregory Commons,Condominium,CONDO-COOP,SOLD,,,2,2,1,2.5,1400,879500.0,899000.0,,628.21,0.9783,,11150.0,965.0,23,2022-07-20,2022-03-30,2022,2022-Q3,False,False,False,40.7658094,-74.0254022,Hackensack Plank Rd & Shippen St.,Penthouse Bliss-Don't Miss Out!,False,low,False,,low,,,,Hoboken,2.074,Port Imperial,1.033,Port Imperial,1.033,,,
210002682,21 CAMBRIDGE WAY,,21 CAMBRIDGE WAY,07086,Weehawken,block_45.01_CAMBRIDGE,45.01,1.01,Henley On Hudson,Condominium,CONDO-COOP,SOLD,,,2,3,0,3.0,1630,880000.0,899000.0,,539.88,0.9789,,16474.0,965.0,50,2021-05-07,2021-02-01,2021,2021-Q2,False,False,False,40.7683891,-74.0166158,River Road to Henley Place to Cambridge Way,"Welcome home to this stunning 2 Bedroom / 3 Bathroom duplex located in prestigious Henley on Hudson. Situated along the banks of the Hudson River, this meticulously kept home stretches across 1,630 SqFt and features beautiful hardwood floors throughout, an open concept, gas fireplace, in-unit laundry, custom window treatments, and one garage parking space. First floor includes entrance foyer, living room / dining room combo, gorgeous Chef's kitchen, and full bathroom. Chef's kitchen features Viking appliances, granite countertops, custom cabinets, and breakfast bar. Travel to the second floor where you'll find a spacious Master bedroom with spa-like ensuite bathroom and walk-in closet, second bedroom with ensuite bathroom, and laundry. Henley on Hudson features world-class amenities including concierge, outdoor pool with jacuzzi, fitness center, movie theatre, kids playroom, social room, and shuttle to/from Ferry and Lightrail station. This is a home you truly do not want to miss!",True,high,False,,low,,,,Hoboken,2.292,Port Imperial,1.269,Port Imperial,1.269,,,
250003252,600 HARBOR BLVD,1032,600 HARBOR BLVD 1032,07086,Weehawken,block_34 03_HARBOR,00034 03,00004 16,Riva Pointe,Condominium,CONDO-COOP,SOLD,,3,2,2,1,2.5,1385,880000.0,799000.0,,635.38,1.1014,,14363.0,1172.0,8,2025-04-30,2025-02-19,2025,2025-Q2,False,False,False,40.7600589,-74.0218974,between 19th & River View Terrace,"Waterfront living at Riva Pointe! Spacious and sunny with a south-facing private balcony, this 2.5 bedroom, 2.5 bath duplex is suspended over the Hudson with stunning NYC views. Modern kitchen with stainless appliances, granite counters, convection oven, microwave, dishwasher & Sub-Zero fridge.  Open living/dining area has a wall of windows, hardwood floors, fireplace, vaulted ceiling & skylight. Also on this floor, a generous bedroom with walk-in closet and full bath,  additional powder room, and in unit washer/dryer.  2nd floor features another spacious bedroom and adjacent loft perfect for office/bedroom/nursery, large bath with tub, stall shower & linen closet, and large storage closet. Includes 1 car garage parking. Building amenities include concierge, multi level gym, indoor pool, and more.  NY Waterway Ferry, NYC bus & Light Rail, Whole Foods, restaurants, Weehawken waterfront park with ball fields, track, and tennis courts are just moments away.",True,high,True,balcony,high,,,,Hoboken,1.683,Port Imperial,0.642,Port Imperial,0.642,,,
220014523,5B WEST 19TH ST,2R,5B WEST 19TH ST 2R,07086,Weehawken,zip_07086,,,,Condominium,CONDO-COOP,SOLD,,2,3,2,0,2.0,1475,880000.0,899000.0,,596.61,0.9789,,,,178,2023-03-20,2022-08-09,2023,2023-Q1,False,False,False,40.7599096,-74.0313893,Hackensack Plank Rd & W18th St,"Don't miss this opportunity to see Weehawken newest development - Le Bateau! Bright and captivating, this spacious 2nd floor condominium has 3 bedrooms and 2 bathrooms with approximately 1,475 sq ft of living space. The striking 11 ft ceiling heights add to the spaciousness of this home. Equipped with chef's kitchen, Bosch stainless steel appliances, modernized cabinetry, in-unit washer/dryer, and in-ceiling speakers managed by Sonos amplifier. 5 wide plank oak hardwood floors throughout, Porcelanosa tile and plumbing fixtures and LED lighting create a true luxurious experience. The builder spared no cost in making this home sound proofed by using sound channels and sound clips, Quietrock, green/noise proofing compound, and even foam insulation, dampening the noise.  It has a dedicated outdoor space and a large 200 ft storage area in the garage, which you can use for recreation. It also comes with two parking spots; one of them can be added to the storage area to make it even bigger and connect it to the outdoor space.",True,medium,False,,low,,,,Hoboken,1.701,Port Imperial,0.733,Port Imperial,0.733,,,
220003307,550 GREGORY AVE,B8,550 GREGORY AVE B8,07086,Weehawken,block_26_GREGORY,00026,00007 01,Bella Vista Estates,Condominium,CONDO-COOP,SOLD,,4,2,2,0,2.0,2006,885000.0,875000.0,,441.18,1.0114,,12521.0,336.0,4,2022-05-02,2022-02-25,2022,2022-Q2,False,False,False,40.7660227,-74.0256059,CORNER OF GREGORY & HACKENSACK,"Welcome home to Bella Vista Estates, the epitome of luxury and convenience. This stunning two bedroom Penthouse condo with soaring 11 ft ceilings and your very own private balcony with breathtaking NYC views is an entertainers delight. Travel into a wide open and light-filled layout to your kitchen, living and dinning area. The chefs kitchen is equipped with a bevy of amenities such as custom cabinetry, stainless steel high end appliances and granite countertops. The open concept between the living and dining area creates the ideal space to entertain friends and family around the fireplace while soaking in uninterrupted views of the city. The oversized windows allow sunlight to drench the entire home offering breathtaking views of the NYC Skyline. The spacious master en-suite boasts built in custom cabinetry, a walk-in closet with ample storage space and a gorgeous master bath that was recently gut renovated with a double sink vanity and a standing shower. This home offers one other spacious bedroom with custom cabinetry, ample storage and one other spacious bathroom with a tub. A super spacious laundry room with a full size washer and dryer is a perfect finishing touch to the home. Benefit from luxury amenities in the building, such as a fitness center, kids room, private storage unit & 1 car parking. Located just 10 minutes from mid-town Manhattan,Free shuttle to NY Waterway ferry & light rail, close to NJ Transit bus, shops, stores, parks and great schools!",True,medium,True,balcony,high,,,,Hoboken,2.089,Port Imperial,1.048,Port Imperial,1.048,,,
230007990,20 WEST 19TH ST,4B,20 WEST 19TH ST 4B,07086,Weehawken,block_5,00005,00009,River Shades Condominium,Condominium,CONDO-COOP,SOLD,,,3,2,1,2.5,1538,888000.0,898000.0,,577.37,0.9889,,10807.0,230.0,17,2023-07-07,2023-05-16,2023,2023-Q3,False,False,False,40.7599096,-74.0313893,Willow Ave and Grand St,"Nestled in The Shades, one of the most desirable and easily commutable sections of Weehawken on the immediate northwestern border of Hoboken, sits this stunning 3 bedroom condo which feels like your own private brownstone in the heart of the city! Upon entering the front door, you step into the open concept main level featuring high ceilings, a state of the art kitchen with a luxurious center island with attention to the smallest of details. The main level also includes a relaxing living room area, powder room, and separate dining area, making it the ultimate entertainment space! Just up the stairs, you'll find 3 generously sized bedrooms, a recently renovated full bathroom in the hallway, and a primary ensuite bathroom also recently renovated. On the ground level, you'll find a shared garage with two car parking and plenty of storage space. So many additional features to list, you have to come see for yourself!",True,medium,False,,low,,,,Hoboken,1.701,Port Imperial,0.733,Port Imperial,0.733,,,
220020167,530 GREGORY AVE,CPH3,530 GREGORY AVE CPH3,07086,Weehawken,block_26_GREGORY,26,4,Gregory Commons Condo,Condominium,CONDO-COOP,SOLD,,,2,2,1,2.5,1850,890000.0,935000.0,,481.08,0.9519,,14151.0,1291.0,78,2023-03-10,2022-11-15,2023,2023-Q1,False,False,False,40.7656932,-74.025874,Hackensack Plank & Shippen,"Once in a Lifetime...Penthouse Oasis...Soaring in the Sky, an elevated private Retreat. Discover Gregory Commons gated luxury condo complex: Amenities: 24hr. Concierge; Fitness center; Indoor Pool; Lounge; Sauna; Gardened Courtyard; maintenance on-site. Pets welcome.  A Prime Location that offers a 2-Mile Dream Commute to NYC- Port. Auth. Don't Miss Out!",False,low,False,,low,,,,Hoboken,2.066,Port Imperial,1.027,Port Imperial,1.027,,,
210021583,1000 AVENUE AT PORT IMPERIAL,#402,1000 AVENUE AT PORT IMPERIAL #402,07086,Weehawken,block_64.01_AVENUE,64.01,1.11,Avenue Collection,Condominium,CONDO-COOP,SOLD,,4,2,2,0,2.0,1484,899000.0,899000.0,,605.8,1.0,,16910.0,1260.0,22,2021-11-08,2021-09-15,2021,2021-Q4,False,False,False,40.774254,-74.011431,Port Imperial Blvd & East Fulton St.,"AMAZING HOME and INCREDIBLE VALUE in this GORGEOUS & LARGE (1484 SqFt!) 2-BED/2-BATH CORNER unit in impeccable condition at AVENUE COLLECTION Port Imperial on the Hudson River Waterfront! Step into a spacious, grand living room with OPEN KITCHEN concept and you'll immediately notice the DISCERNING QUALITY of the finishes: solid hardwood floors, kitchen with custom European cabinets, granite countertops, breakfast bar, GE Monogram stainless steel appliances, oversized windows with remote-controlled motorized blinds, and designer lighting. Excellent rooms with ample closets, great natural light throughout, hotel-style en-suite soaking bathtub and separate shower for the main bedroom, and beautiful guest bathroom. Plus your own DEDICATED GARAGE PARKING SPACE! Built in 2014 (concrete & steel construction), the community amenities include 24-hour concierge, luxurious resident lounges, top-of-the-line fitness center with sauna, shower, and yoga/dance studio, professionally-landscaped outdoor courtyard with lawn, fire pit, sun deck, and magnificent views of the Hudson River and New York City skyline, as well as guest suites for overnight stays. Residents can also access the outdoor pool area (located next door at 1200), featuring lounge/entertainment areas and incredible views of the Hudson and NYC. Nearby NY Waterway Ferry service, Hudson Light Rail & NJ Transit Bus are just steps away. The dream is here, you can have it now! Virtual tour and floor plans available.",True,high,True,deck,high,,,,Hoboken,2.748,Port Imperial,1.743,Port Imperial,1.743,,,
210019056,600 HARBOR BLVD,1022/1122,600 HARBOR BLVD 1022/1122,07086,Weehawken,block_34 0003_HARBOR,00034 0003,00004 0019,Riva Pointe,Condominium,CONDO-COOP,SOLD,,4,2,2,1,2.5,1750,899000.0,899000.0,,513.71,1.0,,13093.0,1446.0,35,2021-10-22,2021-08-11,2021,2021-Q4,False,False,False,40.7600589,-74.0218974,River Road and Harbor Blvd,"Come home to your sunny, south-facing luxury penthouse oasis on a Hudson River pier, w/spectacular, unobstructed Manhattan skyline views from north to south. This rare 1750 SQFT condo combines 2 units, features a massive living room, & fronts a magnificent 40x56' semi-private viewing deck for indoor/outdoor living (only similar unit sold in 2020 w/multiple offers as it hit market). Chip & Joanna Gaines-type renovation combines old & new w/antique doors and marble mantle from mansion & custom layout unique in complex. It's like being on a tranquil boat on sun-dappled water, while just 6 mins from NY by ferry (only Harbor Blvd complex BESIDE ferry). Meet neighbors on landscaped central promenade; heated indoor pool, pet friendly. Lower taxes & maintenance than comparable waterfront units. 2 parking spaces, bus, rail, Lincoln Tunnel access, in walkable neighborhood steps from Whole Foods, top restaurants, with waterfront public playground, track, pool, tennis, and open space.",True,medium,True,deck,high,,,,Hoboken,1.683,Port Imperial,0.642,Port Imperial,0.642,,,
220018794,5B WEST 19TH ST,1R,5B WEST 19TH ST 1R,07086,Weehawken,zip_07086,,,,Condominium,CONDO-COOP,SOLD,,1,3,2,0,2.0,1475,900000.0,899000.0,,610.17,1.0011,,,,12,2022-12-19,2022-10-21,2022,2022-Q4,False,False,False,40.7599096,-74.0313893,Hackensack Plank Rd & W18th St,"Don't miss this opportunity to see Weehawken newest development - Le Bateau! Bright and captivating, this spacious 2nd floor condominium has 3 bedrooms and 2 bathrooms with approximately 1,475 sq ft of living space. The striking 11 ft ceiling heights add to the spaciousness of this home. Equipped with chef's kitchen, Bosch stainless steel appliances, modernized cabinetry, in-unit washer/dryer, and in-ceiling speakers managed by Sonos amplifier. 5 wide plank oak hardwood floors throughout, Porcelanosa tile and plumbing fixtures and LED lighting create a true luxurious experience. The builder spared no cost in making this home sound proofed by using sound channels and sound clips, Quietrock, green/noise proofing compound, and even foam insulation, dampening the noise. It has a private outdoor space and also comes with two parking spots.",True,medium,False,,low,,,,Hoboken,1.701,Port Imperial,0.733,Port Imperial,0.733,,,
