mls_id,address,unit_number,full_address,zip,area,block,block_raw,lot,complex_name,property_type,class,status,year_built,floor_number,bedrooms,full_baths,half_baths,total_baths,sqft,sold_price,list_price,orig_list_price,price_per_sqft,sale_to_list,orig_to_sold_pct,taxes,hoa_monthly,dom,closing_date,listing_date,closing_year,closing_quarter,is_distressed,is_short_sale,is_bank_owned,lat,lon,between,remarks,parking,parking_conf,outdoor,outdoor_type,outdoor_conf,walk_score,transit_score,bike_score,path_station,path_dist_mi,hblr_station,hblr_dist_mi,transit_station,transit_dist_mi,modiiv_assessed,assessed_value,assess_ratio
240014457,883 BLVD EAST,1A,883 BLVD EAST 1A,07086,Weehawken,block_56_BLVD,00056,00011,,Condominium,CONDO-COOP,SOLD,,1,2,1,0,1.0,874,553000.0,550000.0,,632.72,1.0055,,7225.0,476.0,25,2024-10-04,2024-07-25,2024,2024-Q4,False,False,False,40.7671744,-74.0216355,Columbia Terrace & Fulton,"Nestled in the heart of Weehawken, this meticulously renovated 2-bedroom apartment offers breathtaking views of NYC and the Hudson River from every and each room. More than just a home, it's a sanctuary with inspiring views of the NYC skyline. Bathed in natural light, the spacious interior features, generous space, and a layout designed for both comfort and functionality. The building is impeccably maintained with recent updates, ensuring a seamless blend of modern amenities and historic charm.  Every detail of this residence has been carefully crafted to combine modern aesthetics with comfort, providing an unparalleled living experience. Imagine waking up to panoramic vistas that redefine city living, complemented by an effortless commute to NYC thanks to nearby transportation options. This is more than just a place to live; it's a statement of elevated lifestyle and convenience.  Embrace the essence of urban elegance and schedule your private tour today!!",False,low,False,,low,,,,Hoboken,2.174,Port Imperial,1.131,Port Imperial,1.131,,,
210023669,2600 PALISADE AVE,2,2600 PALISADE AVE 2,07086,Weehawken,block_27,00027,00001,,Condominium,CONDO-COOP,SOLD,,3,3,2,0,2.0,1259,555000.0,575000.0,,440.83,0.9652,,7569.0,250.0,19,2022-03-16,2021-10-14,2022,2022-Q1,False,False,False,40.767918,-74.028918,Palisade Ave and 26th St,"GORGEOUS CONDO IN WEEHAWKEN THAT HAS RECENTLY BEEN TOTALLY REMODELED. 3 BEDROOM SECOND Fl UNIT IN A WALK UP BUILDING ENCOMPASSING THE ENTIRE FLOOR, WITH VIEWS OF MANHATTAN. STUNNING KITCHEN WITH STAINLESS STEEL APPLIANCES, AND GRANITE COUNTERTOPS. HIGH 10FT CEILINGS AND PHENOMENAL LIGHTING GIVE AND OPEN AIRY FEEL. BUILDINGS INCLUDES SHARED ACCESS TO RENOVATED FRONT PATIO AREA, PRIVATE USE OF LARGE STORAGE CLOSET IN BASEMENT, AND LAUNDRY IN UNIT. CLOSE TO TRANSPORTATION AND WALKING DISTANCE TO DANIEL WEBSTER ELEMENTARY SCHOOL.",False,low,True,patio,high,,,,Hoboken,2.23,Port Imperial,1.204,Port Imperial,1.204,,,
210012331,941 BLVD EAST,3B,941 BLVD EAST 3B,07086,Weehawken,block_59,00059,00005,River Breeze,Condominium,CONDO-COOP,SOLD,,3,2,2,0,2.0,1010,565000.0,565000.0,,559.41,1.0,,7419.0,550.0,40,2021-09-17,2021-05-21,2021,2021-Q3,False,False,False,40.7671744,-74.0216355,46th St,"A rare opportunity to live on the prestigious Blvd East with a picture frame of unobstructed million-dollar views of New York City and Hudson River at a fraction of the price! Spacious 2 bed 2 bath features open living room/dining room with a bay window and a glass door to a shared balcony. Fully equipped kitchen with light oak cabinets, stainless steel appliances, quartz counter tops, ceramic tile flooring, master suite with walk in closet, black marble accented bath with soak in tub, vanity, and linen closet. Hardwood floors, central air, washer/dryer, pet friendly, elevator building. Weehawken township is a striving community that is rich with history, contains ball fields and top-rated schools, its host of parks, bicycle paths, and walkways overlooking the Hudson River and the Manhattan skyline, full of local shops & restaurants. Quick access to New York City via bus at your front door, ferry, or Lincoln Tunnel, approximately 10 minutes making this a commuter’s dream!  Also the light rail to Hoboken and Jersey City.",False,low,True,balcony,high,,,,Hoboken,2.174,Port Imperial,1.131,Port Imperial,1.131,,,
210019048,600 HARBOR BLVD,879,600 HARBOR BLVD 879,07086,Weehawken,block_34 0003_HARBOR,00034 0003,00004 0019,Riva Pointe,Condominium,CONDO-COOP,SOLD,,2,1,1,0,1.0,887,565000.0,549000.0,,636.98,1.0291,,8554.0,761.0,49,2021-11-18,2021-08-11,2021,2021-Q4,False,False,False,40.7600589,-74.0218974,River Road to Harbor Blvd,"Reach out and touch the spectacular views of NYC and The Hudson River from this spacious one bedroom, one bath condo. Located at the far end of the building pier in the highly desirable newer section of the complex. Enjoy waterfront vistas from your private balcony or curl up by the wood burning fireplace when the seasons change. You will love the upgraded open concept kitchen with new stone counters and new stainless steel appliances. This unit is move-in ready with a fresh paint job, beautiful wood flooring throughout, and washer/dryer in unit. Enjoy the best of both worlds with townhouse style private entrance to each unit, and condo amenities including garage parking, state-of-the-art gym, indoor heated pool, 24 hr concierge all included. This is the best location on the waterfront with Whole Foods, Ferry, Light Rail and Bus all at your doorstep.",True,high,True,balcony,high,,,,Hoboken,1.683,Port Imperial,0.642,Port Imperial,0.642,,,
250004090,530 GREGORY AVE,410C,530 GREGORY AVE 410C,07086,Weehawken,block_26_GREGORY,26,4,Gregory Commons,Condominium,CONDO-COOP,SOLD,,4,2,2,0,2.0,1375,565000.0,579000.0,,410.91,0.9758,,8565.0,1088.0,27,2025-06-02,2025-03-05,2025,2025-Q2,False,False,False,40.7656932,-74.025874,Hackensack Plank & Shippen St.,,False,low,False,,low,,,,Hoboken,2.066,Port Imperial,1.027,Port Imperial,1.027,,,
210013593,518-530 GREGORY AVE,A101,518-530 GREGORY AVE A101,07086,Weehawken,block_26_GREGORY,00026,00004,Gregory Commons Condo,Condominium,CONDO-COOP,SOLD,,1,2,2,0,2.0,1300,565000.0,575000.0,,434.62,0.9826,,10672.0,873.0,223,2022-02-18,2021-06-04,2022,2022-Q1,False,False,False,40.7655848,-74.0261203,Hackensack Plank & Shippen,"Discover this Coveted Corner, Luxury Loft 2 Bedroom 2 Bath condo with enormous, East facing Outdoor Oasis & Inspiring NYC Views. A stellar Weehawken location surrounded by every convenience & amenities. Enjoy seasonal views of the fascinating, evolving Hudson Yards & Incredible Iconic Freedom Tower on your very own Huge Balcony. Relax or entertain in the spring & summer months outside. Whether working from home in or outdoors, having a Balcony is a true luxury! This corner loft features impressive design & appealing features from walls of oversized new windows to Soaring 14ft double height ceilings. Offering an Ideal open concept, sun-filled corner living space with plenty of room for a spacious Dining area & Home office. The Modern Open Kitchen offers brand new stainless refrigerator, Granite counters+Bistro bar; Perfect for seamless entertaining & everyday alike. A Modern tiled guest full bath with pedestal sink is off the hallway. The Master Bedroom offers en-suite windowed Modern luxury Bath w/ Jacuzzi & walls of closets; there is abundant useful storage space in the unique upper loft closets. Across the hallway find the 2nd Bedroom with stylish new flooring & presents the option for dedicated home office, Den et al.  This is one of the most desirable lines in the building, with its oversized East facing Balcony space that measures 200+-sq. ft. & striking NYC Skyline Views-a True Luxury. Notable features: Central A/C;  New thermal windows; Refrigerator; freshly painted; hardwood flooring thru-out. HOA includes: 1 Garage Parking; Water; Amenities: 24hr concierge; In-door Pool; Fitness; New Lounge; storage avail. Maintenance on site; Pets welcome. Discover Gregory Commons Gated Luxury condo complex. A Prime Weehawken location that offers a Dream Commute to NYC-only 2 miles to Port. Auth. A short stroll to Terrific Shopping, Dining, Eateries, Whole Foods & Waterfront Lincoln Harbor; Light Rail train; NY Waterway Ferry service, Historic Reservoir Park et al.  Don't Miss out!",True,high,True,balcony,high,,,,Hoboken,2.059,Port Imperial,1.021,Port Imperial,1.021,,,
210023311,600 HARBOR BLVD,868,600 HARBOR BLVD 868,07086,Weehawken,complex_RIVAPOINTE,,,Riva Pointe,Condominium,CONDO-COOP,SOLD,,3,1,1,0,1.0,887,565000.0,550000.0,,636.98,1.0273,,8260.0,761.0,3,2021-11-18,2021-10-08,2021,2021-Q4,False,False,False,40.7600589,-74.0218974,River Rd To Harbor Rd,"Welcome To The Ultimate Location On The Waterfront Along The Gold Coast. Sparkling NYC Skyline And Hudson River Views Can Be Yours In This Highly Sought After Southern Exposure 1 Bedroom 1 Bath Condo. Enjoy The Best Sunsets On Your Own Private Balcony!This Unit Is Located At The Far End Of The Building Pier In The Desirable Newer Section Of The Complex With A Townhouse Private Style Entrance On The Promenade Level. Loaded With Modern Features This Unit Offers Beautiful Hardwood Floors, Granite Counter Tops With Breakfast Bar In Kitchen, Stainless Steel Appliance Suite, Spacious Living Room With Real Wood Burning Fireplace, Generous Dining Area, Large Windows, Abundant Closet Space And Extra Storage Space (Rare) Right Outside Your Door Next To Unit. Building Amenities Include Parking Space, State-Of-The-Art Health Club, Yoga Room, Indoor Heated Pool, Community Room, Playroom, 24/7 Concierge, Elevator And Garage Parking For Guests. Riva Point Provides Easy Access To Whole Foods, Chart House, Ruth Chris Steakhouse, Hoboken, The Lincoln Tunnel & Rt. 495. Super Convenient Commute To NYC - Right Next To The Ferry (8 Mins To Midtown Manhattan), Bus Stop (10 Mins To Port Authority), And Hudson/Bergen Light Rail. Live Your Best Life Here! You Deserve It!",True,high,True,balcony,high,,,,Hoboken,1.683,Port Imperial,0.642,Port Imperial,0.642,,,
210023996,963 BLVD EAST,1-4,963 BLVD EAST 1-4,07086,Weehawken,block_94,94,9,,Condominium,CONDO-COOP,SOLD,,,2,2,0,2.0,806,568000.0,568000.0,,704.71,1.0,,8260.0,225.0,24,2022-01-21,2021-10-19,2022,2022-Q1,False,False,False,40.7793943,-74.0120104,46th & 47th Street & Blvd East,"Situated along the breathtaking landscape of the highly sought-after Boulevard East locale, you will discover a one-of-a-kind home showcasing the most glorious panoramic views of NYC and the Hudson River. From this idyllic backdrop, welcome to a beautiful and fully renovated 2 Bedroom / 2 Full Bathroom Duplex that will sure to please. Upon entry, you will be greeted by an inviting open layout, gleaming hardwood floors, an exposed brick wall, a spacious living space with large windows to enjoy those NYC views, and the dining area. From there, you will find a modern kitchen complete with stainless steel appliances and smart storage with extra cabinetry and a cutting board station against the wall. Down the hall, enjoy the fully renovated bathroom and generous size bedroom with access through the window to the backyard. Making your way downstairs to your very own primary suite, enjoy the modern farmhouse look of sliding barn doors to the bedroom, master closet, and a full bathroom featuring a combination washer/dryer. To complete your pristine residence, enjoy the additional shared laundry in the basement area and the lovely shared backyard for outdoor entertaining and fêtes. NYC transportation at your door, with highly-acclaimed restaurants, grocery stores, shopping, world-class recreation, and all major thoroughfares within the easiest of reach. The loveliest and unique gem of a residence in the best location and within the heartbeat of one of the most desired cities, you will want to make this your home today!",False,low,True,yard,high,,,,Hoboken,3.086,Port Imperial,2.066,Port Imperial,2.066,,,
210022999,600 HARBOR BLVD,955,600 HARBOR BLVD 955,07086,Weehawken,block_34 0003_HARBOR,00034 0003,00004 0019,Riva Pointe,Condominium,CONDO-COOP,SOLD,,3,1,1,0,1.0,873,568000.0,565000.0,,650.63,1.0053,,8759.0,749.0,52,2022-01-14,2021-10-05,2022,2022-Q1,False,False,False,40.7600589,-74.0218974,River Road to Harbor Blvd,"Welcome to the Ultimate Location On The Waterfront! Enjoy spectacular Manhattan and Hudson River views from this airy one bedroom, one bath condo in the coveted newer phase of the complex. Move-in ready with polished wood flooring and upgraded kitchen with stone counters, stainless steel appliances, and tile backsplash. Warm up to the wood burning fireplace or enjoy the sun and views from the spacious private balcony. Washer/dryer in unit, 24 Hour Concierge, State-of-the-Art Fitness Center, Indoor Pool, and one Garaged Parking Space all included. Super convenient commute to NYC via Ferry, Light Rail or bus. Whole Foods, Ruth Chris, and Chart House at your doorstep. Live here and feel like you're on vacation every day!",True,high,True,balcony,high,,,,Hoboken,1.683,Port Imperial,0.642,Port Imperial,0.642,,,
210015676,600 HARBOR BLVD,920,600 HARBOR BLVD 920,07086,Weehawken,block_34 03_HARBOR,00034 03,00004 16,Riva Pointe,Condominium,CONDO-COOP,SOLD,,3,1,1,1,1.5,873,569000.0,585000.0,,651.78,0.9726,,8567.0,749.0,18,2021-08-25,2021-06-30,2021,2021-Q3,False,False,False,40.7600589,-74.0218974,River Rd to Harbor Blvd,"Here comes the Sun! Breathtaking views of the Hudson River and World Trade Center skyline can be yours in this highly desirable southern exposure 1 bedroom 1.5 bath condo. Enjoy waterfront sunsets from your private balcony or curl up by the wood burning fireplace when the seasons change. Luxurious upgraded kitchen with granite counter tops, stainless steel appliances, and rich wood cabinetry. Washer/dryer in unit, one garaged parking space included. 24 hour concierge, gated garage, state-of-the-art gym, yoga room, indoor pool, community and playroom all included. The best location on the Waterfront offers Whole Foods right across the street, restaurants within walking distance, and very convenient transportation via NYC Ferry, Light Rail, and Bus.",True,high,True,balcony,high,,,,Hoboken,1.683,Port Imperial,0.642,Port Imperial,0.642,,,
210005292,59A CHESTNUT ST,,59A CHESTNUT ST,07086,Weehawken,block_3,3,21.01,,Condominium,CONDO-COOP,SOLD,,,3,2,0,2.0,1271,570000.0,579000.0,,448.47,0.9845,,8816.0,475.0,20,2021-05-20,2021-03-05,2021,2021-Q2,False,False,False,40.7595181,-74.0310461,W19th & Grand St,"3BR MODERN TOWNHOUSE BORDERING HOBOKEN & WEEHAWKEN. Experience complete privacy in this three bedroom, two bathroom townhouse in the highly-desirable and secluded Weehawken neighborhood, The Shades. Upon entering this home, the parlor level reveals an open concept living space, skylight that shines through the kitchen, guest bedroom and full bath. Landing on the second level is the large master bedroom with walk-in closet, a hallway with a balcony that overlooks the parlor level, laundry room, third bedroom and second full bath. This home also features: central A/C, includes TWO covered GARAGE PARKING spots and nears Pizzuta Park, Whole Foods, Trader Joes, West Elm, Lincoln Tunnel, Lincoln Harbor Light Rail Station, I-495, NJ Transit, Hoboken or Weehawken Hudson River waterfront, shops and top rated restaurants.",True,high,True,balcony,high,,,,Hoboken,1.671,Port Imperial,0.7,Port Imperial,0.7,,,
240019516,518-536 GREGORY AVE,A320,518-536 GREGORY AVE A320,07086,Weehawken,block_25,25,4,The Gregory Commons,Condominium,CONDO-COOP,SOLD,,3,2,2,0,2.0,1380,575000.0,580000.0,,416.67,0.9914,,7983.0,1098.0,97,2025-03-07,2024-10-03,2025,2025-Q1,False,False,False,,,Hackensack Plank Rd & Shippen st,"Discover Gregory Commons Gated Luxury condo complex in the midst of wonderful capital improvements; common areas et al. that will enhance sustainability, curb appeal & value.  A Stellar location-situated atop the bluffs in Prime Weehawken.  Just minutes to Whole foods, Lidl, Trader Joe, terrific shopping, Dining, Cafes. A short stroll to Lincoln Harbor, New Waterfront Park w/ Tennis cts. Reservoir Park.  A Dream Commute to NYC-Only 2 miles to NYC Port Auth.  Hassle free commuter options are steps away. Don't Miss Out!",False,low,False,,low,,,,,,,,,,,,
210013007,1826 WILLOW AVE,101,1826 WILLOW AVE 101,07086,Weehawken,block_9,00009,00007,,Condominium,CONDO-COOP,SOLD,,1,2,2,0,2.0,1094,575000.0,599000.0,,525.59,0.9599,,7169.0,644.0,16,2021-08-20,2021-05-31,2021,2021-Q3,False,False,False,40.759089,-74.0281339,Park & Willow,"Look no further! Beautiful newly renovated condo in wonderful central location of Weehawken. Only steps away from Hoboken and in close proximity to JC and NYC. It features a spacious open floor with and oversized living room a beautiful kitchen boosted by Cherrywood cabinets and granite counter tops, central air conditioning, marble tiled bathrooms with jacuzzi tub, 10½ foot ceilings, and washer/dryer in unit. Deeded 750 sq ft Backyard, deeded parking space and storage space in basement is a plus. Commuter dream. Buses to NYC across street, minutes from Lincoln Tunnel. Access to Waterway Ferry. light Rail to Path Train. Close to waterfront shopping, restaurants, boardwalks, parks and much more. A must see!",True,high,True,yard,high,,,,Hoboken,1.619,Port Imperial,0.606,Port Imperial,0.606,,398700.0,1.4422
230020518,518 GREGORY AVE,A202,518 GREGORY AVE A202,07086,Weehawken,block_26_GREGORY,00026,00004,Gregory Commons,Condominium,CONDO-COOP,SOLD,,1,2,2,0,2.0,1551,575000.0,599000.0,,370.73,0.9599,,9887.0,1107.0,124,2024-06-03,2023-12-11,2024,2024-Q2,False,False,False,40.7658094,-74.0254022,Hackensack Plank Rd & Shippen St,"True loft living at its best! First level features soaring 16ft ceiling in the living/dining room, a beautiful renovated kitchen, a large bedroom and full bath. Second level features a huge loft bedroom that overlooks the living area, a full bath and an office/den (can be used as a 3rd bedroom). This unique duplex has hardwood floors throughout, lots of closet space, central air, private patio and one garage parking spot! Building amenities include 24 hour concierge, indoor pool, fitness center and communal courtyard with amazing views of the NY Skyline. Easy commute to NYC, bus at corner and just minutes to Weehawken Ferry, Hoboken, Trader Joe's, Whole foods and Restaurants!  Don't miss this opportunity to live in beautiful Gregory Commons!",True,high,True,patio,high,,,,Hoboken,2.074,Port Imperial,1.033,Port Imperial,1.033,,,
220021379,600 HARBOR BLVD,948,600 HARBOR BLVD 948,07086,Weehawken,block_34.03_HARBOR,34.03,4.16,,Condominium,CONDO-COOP,SOLD,,2,1,1,0,1.0,873,575000.0,580000.0,,658.65,0.9914,,8754.0,967.0,35,2023-06-15,2022-12-13,2023,2023-Q2,False,False,False,40.7600589,-74.0218974,19th Street and River View Terrace,"Just steps from express ferry (8 min), bus (10 mins), and light rail service, the Luxury Condos, Riva Point, are a commuter’s dream! This highly desirable 1BR with unobstructed views of NYC and the Hudson River.This beautiful home features an open kitchen layout, stainless steel appliances, wood-burning fire places, Washer/Dryer in unit, one garage parking space, and extra-large windows. Community include 24-hour concierge services, elevators, secured street-level parking, indoor heated pool, fitness facility with sauna, and much more. Enjoy the best of both worlds with townhouse style private entrance to each unit, and condo amenities. Next to hot restaurants, cafe, Wholefoods, Hudson River Promenade, Sheraton Hotel, and so much.",True,high,False,,low,,,,Hoboken,1.683,Port Imperial,0.642,Port Imperial,0.642,,,
260002942,47 47TH ST,9,47 47TH ST 9,07086,Weehawken,block_60,60,39,The Astor Condominium,Condominium,CONDO-COOP,ACTIVE,,0,2,2,0,2.0,1403,,577000.0,,,,,7419.0,593.0,51,,2026-02-19,,,False,False,False,40.7776963,-74.0151981,blvd east & park ave,"Discover elevated living in one of Weehawken's most coveted locations. Located just 1/2 block from Blvd East where sweeping views of the iconic New York City skyline and access to premier commuter options including ferry, bus and light rail. This beautifully appointed 1,403-square-foot one level residence offers a rare blend of privacy, sophistication and indoor-outdoor living. Enter through your private ground level entrance into a thoughtfully renovated, light-filled interior where an open-concept living and kitchen space creates an ideal setting for both entertaining and everyday comfort. Sleek stainless steel appliances and modern finishes elevate the heart of the home. Designed with both style and function in mind, the residence features two generously scaled bedrooms each with custom designed closets, including a primary suite that is currently being used as an office with custom built in desk and cabinets. The hallway features custom molding that highlights a gallery wall of art. A dedicated in unit laundry room and exceptional closet space further enhance the home's effortless livability. A true standout feature is the private backyard retreat exclusively for this unit, an uncommon luxury in this location that offers a tranquil setting for morning coffee, outdoor dining, or quiet relaxation. Enjoy endless dining and shopping options in the neighborhood. This exceptional home presents a compelling value in a premier commuter setting.",False,low,True,yard,high,,,,Hoboken,2.938,Port Imperial,1.908,Port Imperial,1.908,,,
210023378,518-530 GREGORY AVE,A206,518-530 GREGORY AVE A206,07086,Weehawken,zip_07086,,,Gregory Commons,Condominium,CONDO-COOP,SOLD,,1,3,2,0,2.0,1765,580000.0,609000.0,,328.61,0.9524,,13266.0,1295.0,39,2022-02-01,2021-10-10,2022,2022-Q1,False,False,False,40.7655848,-74.0261203,Off Hackensack Plank Road,"Spacious 2 level loft with 15Ft windows and unobstructed view of Manhattan skyline.  Newly refurbished hardwood floors and new carpeting throughout. Washer/dryer in unit.  24 Hr doorman, indoor pool, gym, washer/dryer room.  Sold as is.  One assigned garage parking spot included.",True,high,False,,low,,,,Hoboken,2.059,Port Imperial,1.021,Port Imperial,1.021,,,
230007592,600 HARBOR BLVD,950,600 HARBOR BLVD 950,07086,Weehawken,zip_07086,,,Riva Point e,Condominium,CONDO-COOP,SOLD,,,1,1,1,1.5,873,580000.0,575000.0,,664.38,1.0087,,8682.0,749.0,51,2023-07-20,2023-05-10,2023,2023-Q3,False,False,False,40.7600589,-74.0218974,Lincoln Harbor Riva Point,"Welcome to Riva Pointe in Lincoln Harbor, Weehawken, NJ. One of the most sought-after riverfront locations along the NJ Gold Coast. This prime waterfront is 873 sq.ft. 1 bedroom, 1 bath riverfront condo is an exceptional value. Take your shoes off and relax on your spacious balcony with amazing South East Views of Midtown and Lower Manhattan and the Hudson River! Open Kitchen Layout with fireplace. Washer / Dryer in unit. Hardwood floors throughout. Garage parking, heated indoor pool, State-of-the-art gym, and 24-hour concierge included. NY Waterways stop literally right next to the Riva Pointe community. In addition, Whole Foods is across the street from amazing restaurants, with easy access to a bus to NYC. What else can you possibly need with this amazing location?",True,high,True,balcony,high,,,,Hoboken,1.683,Port Imperial,0.642,Port Imperial,0.642,,,
210026556,200 HIGHPOINT AVE,3,200 HIGHPOINT AVE 3,07086,Weehawken,block_17,00017,00023,Cardiff hall,Condominium,CONDO-COOP,SOLD,,2,2,1,1,1.5,1450,580000.0,590000.0,,400.0,0.9831,,8130.0,271.0,20,2022-01-31,2021-12-03,2022,2022-Q1,False,False,False,40.764837,-74.029095,Palisade and Hudson,"One-of-a-kind 1,450 sq ft, 2 bedrooms, 1.5 bathrooms condo with beautiful NYC and reservoir views from the PRIVATE BALCONY. Located in the secluded Palisades section of Weehawken, this sun-drenched condo's distinct characteristics include an oversized living room with east exposures, high ceilings, and hardwood floors. Upgrades include all NEW windows throughout (13 total), and a newer fridge, dishwasher, stove, and lights. Additional features spacious bedrooms with w/extra storage, in-unit washer & dryer, and storage in the basement. Easy commute to NYC via direct bus, ferry, and Light Rail. Near Whole Foods, Trader Joe's, and Weehawken Waterfront Park and pool. High WalkScore and near schools, daycare, food, and shopping.",False,low,True,balcony,high,,,,Hoboken,2.019,Port Imperial,0.999,Port Imperial,0.999,,,
230020598,518-536 GREGORY AVE,C302,518-536 GREGORY AVE C302,07086,Weehawken,block_26_GREGORY,00026,00004,Gregory Commons,Condominium,CONDO-COOP,SOLD,,3,2,2,0,2.0,1200,582500.0,589999.0,,485.42,0.9873,,8206.0,905.0,228,2024-09-12,2023-12-12,2024,2024-Q3,False,False,False,,,Hackensack Plank Rd and Shippen St,"Spectacular river and NYC views from your own private sanctuary.  Kitchen (granite countertops) and baths were redone, hot water heater and washer/dryer in the apartment, window treatments are Hunter Douglas.   Parking included in maintenance.  This location offers a large options of eateries, cafes, restaurants as well as markets such as Whole Foods and Trader Joe.  Don't miss out - This apartment is a MUST SEE.  The assessment for this apartment is PAID IN FULL. You are far enough away from the hustle and bustle of Manhattan to enjoy the peace and serenity of suburbia, but, should you enjoy the urban scene transportation to NY is near.",True,high,False,,low,,,,,,,,,,,,
